slug,en,de,fr,it
accel-club,E-commerce brand aggregator acquiring and scaling Amazon marketplace businesses,E-Commerce-Markenaggregator für den Erwerb und die Skalierung von Amazon-Marktplatzgeschäften,Agrégateur de marques e-commerce acquérant et développant des activités sur la marketplace Amazon,Aggregatore di marchi e-commerce che acquisisce e sviluppa attività sul marketplace Amazon
acronis,"Cyber protection platform combining backup, disaster recovery, and endpoint security","Cyberprotection-Plattform für Backup, Disaster Recovery und Endpunktsicherheit","Plateforme de cyberprotection combinant sauvegarde, reprise après sinistre et sécurité des terminaux","Piattaforma di cyberprotezione che combina backup, disaster recovery e sicurezza degli endpoint"
adyen,Global payments platform enabling businesses to accept payments across channels and markets.,"Globale Zahlungsplattform, die Unternehmen Zahlungsabwicklung über alle Kanäle und Märkte ermöglicht.",Plateforme de paiement mondiale permettant aux entreprises d’accepter des paiements sur tous les canaux et marchés.,Piattaforma di pagamento globale che consente alle aziende di accettare pagamenti su tutti i canali e mercati.
amazon,"Global technology company offering e-commerce, cloud computing, and AI services","Globales Technologieunternehmen für E-Commerce, Cloud Computing und KI-Dienste","Entreprise technologique mondiale proposant e-commerce, cloud computing et services d'IA","Azienda tecnologica globale che offre e-commerce, cloud computing e servizi di IA"
ami,"AMI is an AI research company building frontier world model-based artificial intelligence. The company develops AI systems that understand the real world, have persistent memory, and can reason and plan, combining scientific rigor with engineering excellence.","AMI ist ein KI-Forschungsunternehmen, das an fortschrittlicher, auf Weltmodellen basierender künstlicher Intelligenz arbeitet. Das Unternehmen entwickelt KI-Systeme, die die reale Welt verstehen, über persistenten Speicher verfügen und planen können – mit wissenschaftlicher Präzision und technischer Exzellenz.","AMI est un laboratoire de recherche en IA qui développe des systèmes d’intelligence artificielle fondés sur des modèles du monde. L’entreprise conçoit des systèmes capables de comprendre le monde réel, de mémoriser et de raisonner, en alliant rigueur scientifique et excellence technique.","AMI è un laboratorio di ricerca nel campo dell’intelligenza artificiale che sviluppa sistemi di IA basati su modelli del mondo. L’azienda progetta sistemi in grado di comprendere il mondo reale, memorizzare e pianificare, unendo rigore scientifico ed eccellenza ingegneristica."
apify,"Cloud platform for web scraping, browser automation, and data extraction","Cloud-Plattform für Web Scraping, Browser-Automatisierung und Datenextraktion","Plateforme cloud pour le web scraping, l'automatisation de navigateur et l'extraction de données","Piattaforma cloud per web scraping, automazione del browser ed estrazione dati"
apple,"Consumer electronics, software, and services company","Unternehmen für Unterhaltungselektronik, Software und Dienstleistungen","Entreprise d'électronique grand public, de logiciels et de services","Azienda di elettronica di consumo, software e servizi"
black-forest-labs,Black Forest Labs is an AI company building advanced generative image and video models and the infrastructure around them.,"Black Forest Labs ist ein KI-Unternehmen, das fortschrittliche generative Bild- und Videomodelle sowie die dazugehoerige Infrastruktur entwickelt.",Black Forest Labs est une entreprise d'IA qui developpe des modeles generatifs avances pour l'image et la video ainsi que l'infrastructure associee.,Black Forest Labs e un'azienda di IA che sviluppa modelli generativi avanzati per immagini e video e la relativa infrastruttura.
bloom-diy,No-code platform for building and sharing cross-platform mobile apps,No-Code-Plattform zum Erstellen und Teilen plattformübergreifender mobiler Apps,Plateforme no-code pour créer et partager des applications mobiles multiplateformes,Piattaforma no-code per creare e condividere app mobili multipiattaforma
brainrocket,Technology company building products for fintech and iGaming industries,Technologieunternehmen mit Produkten für die Fintech- und iGaming-Branche,Entreprise technologique développant des produits pour les secteurs fintech et iGaming,Azienda tecnologica che sviluppa prodotti per i settori fintech e iGaming
chipmind,AI-powered tools for semiconductor chip design and verification,KI-gestützte Werkzeuge für Halbleiter-Chipdesign und -verifikation,Outils basés sur l'IA pour la conception et la vérification de puces semi-conductrices,Strumenti basati sull'IA per la progettazione e la verifica di chip semiconduttori
cloudflare,"Web infrastructure and security company providing CDN, DDoS protection, and edge computing","Webinfrastruktur- und Sicherheitsunternehmen für CDN, DDoS-Schutz und Edge Computing","Entreprise d'infrastructure web et de sécurité fournissant CDN, protection DDoS et edge computing","Azienda di infrastruttura web e sicurezza che fornisce CDN, protezione DDoS ed edge computing"
constructor-tech,AI-powered product discovery and search platform for e-commerce,KI-gestützte Produktentdeckungs- und Suchplattform für E-Commerce,Plateforme de découverte de produits et de recherche basée sur l'IA pour le e-commerce,Piattaforma di ricerca e scoperta prodotti basata sull'IA per l'e-commerce
corintis,Microfluidic cooling technology for high-performance computer chips,Mikrofluidische Kühltechnologie für Hochleistungs-Computerchips,Technologie de refroidissement microfluidique pour puces informatiques hautes performances,Tecnologia di raffreddamento microfluidico per chip ad alte prestazioni
databricks,Unified data analytics and AI platform built on Apache Spark,Einheitliche Datenanalyse- und KI-Plattform auf Basis von Apache Spark,Plateforme unifiée d'analyse de données et d'IA basée sur Apache Spark,Piattaforma unificata di analisi dati e IA basata su Apache Spark
deepjudge,AI-powered search engine for legal professionals and enterprises,KI-gestützte Suchmaschine für Juristen und Unternehmen,Moteur de recherche basé sur l'IA pour les professionnels du droit et les entreprises,Motore di ricerca basato sull'IA per professionisti legali e aziende
deepmind,AI research laboratory focused on developing artificial general intelligence,KI-Forschungslabor mit Fokus auf die Entwicklung künstlicher allgemeiner Intelligenz,Laboratoire de recherche en IA axé sur le développement de l'intelligence artificielle générale,Laboratorio di ricerca sull'IA focalizzato sullo sviluppo dell'intelligenza artificiale generale
depoly,Swiss chemical recycling startup that converts PET plastic waste back into its original raw materials using a novel patented depolymerization process.,"Schweizer Chemie-Recycling-Startup, das PET-Kunststoffabfall mithilfe eines neuartigen patentierten Depolymerisierungsverfahrens in seine urspruenglichen Rohstoffe zurueckverwandelt.",Startup suisse de recyclage chimique qui reconvertit les dechets plastiques PET en matieres premieres grace a un procede brevete de depolymerisation.,Startup svizzera di riciclaggio chimico che riconverte i rifiuti plastici in PET nelle materie prime originali tramite un processo brevettato di depolimerizzazione.
dphi-space,Satellite infrastructure company providing on-orbit computing and hosted payloads,Satelliteninfrastrukturunternehmen für On-Orbit-Computing und gehostete Nutzlasten,Entreprise d'infrastructure satellitaire fournissant du calcul en orbite et des charges utiles hébergées,Azienda di infrastruttura satellitare che fornisce calcolo in orbita e carichi utili ospitati
elevenlabs,Voice AI research and deployment company for speech synthesis and cloning,Voice-KI-Forschungs- und Bereitstellungsunternehmen für Sprachsynthese und Stimmklonen,Entreprise de recherche et déploiement d'IA vocale pour la synthèse et le clonage vocal,Azienda di ricerca e distribuzione di IA vocale per la sintesi e la clonazione vocale
ethon-ai,Industrial AI platform for manufacturing quality optimization,Industrielle KI-Plattform zur Optimierung der Fertigungsqualität,Plateforme d'IA industrielle pour l'optimisation de la qualité de fabrication,Piattaforma di IA industriale per l'ottimizzazione della qualità produttiva
exa-ai,AI-powered web search API for developers and AI applications,KI-gestützte Websuch-API für Entwickler und KI-Anwendungen,API de recherche web basée sur l'IA pour les développeurs et les applications d'IA,API di ricerca web basata sull'IA per sviluppatori e applicazioni di IA
figma,Collaborative design platform for product teams,Kollaborative Designplattform für Produktteams,Plateforme de design collaboratif pour les équipes produit,Piattaforma di design collaborativo per team di prodotto
glovo,"On-demand delivery platform for food, groceries, and everyday essentials","On-Demand-Lieferplattform für Essen, Lebensmittel und Alltagsprodukte","Plateforme de livraison à la demande pour repas, courses et produits du quotidien","Piattaforma di consegna on-demand per cibo, spesa e prodotti di uso quotidiano"
google,"Technology company specializing in search, advertising, cloud computing, and AI","Technologieunternehmen spezialisiert auf Suche, Werbung, Cloud Computing und KI","Entreprise technologique spécialisée dans la recherche, la publicité, le cloud computing et l'IA","Azienda tecnologica specializzata in ricerca, pubblicità, cloud computing e IA"
hypermasters,Mobile game development studio,Entwicklungsstudio für mobile Spiele,Studio de développement de jeux mobiles,Studio di sviluppo di giochi per dispositivi mobili
incode,AI-powered identity verification and fraud prevention platform,KI-gestützte Plattform zur Identitätsverifizierung und Betrugsprävention,Plateforme de vérification d'identité et de prévention de la fraude basée sur l'IA,Piattaforma di verifica dell'identità e prevenzione frodi basata sull'IA
instories,Mobile app for creating animated stories and social media content,Mobile App zur Erstellung animierter Stories und Social-Media-Inhalte,Application mobile pour créer des stories animées et du contenu pour les réseaux sociaux,App mobile per creare storie animate e contenuti per i social media
jetbrains,Developer tools company creating IDEs and programming productivity software,Entwicklertools-Unternehmen für IDEs und Programmierproduktivitätssoftware,Entreprise d'outils de développement créant des IDE et des logiciels de productivité pour programmeurs,Azienda di strumenti per sviluppatori che crea IDE e software di produttività per la programmazione
julius-baer,Swiss private banking and wealth management group,Schweizer Privatbank- und Vermögensverwaltungsgruppe,Groupe suisse de banque privée et de gestion de patrimoine,Gruppo svizzero di private banking e gestione patrimoniale
kodland,Online coding and design school for children aged 5-17,Online-Programmier- und Designschule für Kinder von 5 bis 17 Jahren,École en ligne de programmation et de design pour les enfants de 5 à 17 ans,Scuola online di programmazione e design per bambini dai 5 ai 17 anni
kpmg,"Professional services firm providing audit, tax, and advisory services","Wirtschaftsprüfungs- und Beratungsunternehmen für Audit, Steuern und Beratung","Cabinet de services professionnels fournissant audit, fiscalité et conseil","Società di servizi professionali che fornisce audit, fiscalità e consulenza"
kraken,Cryptocurrency exchange platform for trading digital assets,Kryptowährungsbörse für den Handel mit digitalen Vermögenswerten,Plateforme d'échange de cryptomonnaies pour le trading d'actifs numériques,Piattaforma di scambio di criptovalute per il trading di asset digitali
lakera,AI security platform protecting LLM-powered applications,KI-Sicherheitsplattform zum Schutz von LLM-basierten Anwendungen,Plateforme de sécurité IA protégeant les applications basées sur les LLM,Piattaforma di sicurezza IA per la protezione di applicazioni basate su LLM
lightpanda,Open-source headless browser built for AI and automation,Open-Source-Headless-Browser für KI und Automatisierung,Navigateur headless open source conçu pour l'IA et l'automatisation,Browser headless open source progettato per IA e automazione
luxoft,Global IT services and consulting company,Globales IT-Dienstleistungs- und Beratungsunternehmen,Entreprise mondiale de services informatiques et de conseil,Azienda globale di servizi IT e consulenza
lyceum,European GPU cloud platform for AI training and inference,Europäische GPU-Cloud-Plattform für KI-Training und -Inferenz,Plateforme cloud GPU européenne pour l'entraînement et l'inférence d'IA,Piattaforma cloud GPU europea per l'addestramento e l'inferenza di IA
mckinsey,Global management consulting firm,Globale Unternehmensberatung,Cabinet mondial de conseil en management,Società globale di consulenza manageriale
meta,Social technology company building products for connecting people and immersive experiences,Social-Technology-Unternehmen für Produkte zur Vernetzung und immersive Erlebnisse,Entreprise de technologie sociale développant des produits pour connecter les gens et des expériences immersives,Azienda di tecnologia sociale che sviluppa prodotti per connettere le persone e esperienze immersive
netflix,"Global streaming entertainment service offering a wide library of films, series, documentaries, and games across 190+ countries.","Globaler Streaming-Unterhaltungsdienst mit einer umfangreichen Bibliothek an Filmen, Serien, Dokumentationen und Spielen in über 190 Ländern.","Service mondial de divertissement en streaming proposant une vaste bibliothèque de films, séries, documentaires et jeux dans plus de 190 pays.","Servizio globale di intrattenimento in streaming che offre un'ampia libreria di film, serie, documentari e giochi in oltre 190 paesi."
nexthink,Digital employee experience management platform,Plattform für digitales Employee Experience Management,Plateforme de gestion de l'expérience numérique des employés,Piattaforma di gestione dell'esperienza digitale dei dipendenti
notion,"All-in-one workspace for notes, docs, project management, and AI","All-in-One-Workspace für Notizen, Dokumente, Projektmanagement und KI","Espace de travail tout-en-un pour notes, documents, gestion de projet et IA","Workspace all-in-one per note, documenti, gestione progetti e IA"
patek-philippe,Swiss luxury watch manufacturer,Schweizer Luxusuhrenhersteller,Manufacture horlogère suisse de luxe,Produttore svizzero di orologi di lusso
perplexity-ai,AI-powered answer engine and search platform,KI-gestützte Antwortmaschine und Suchplattform,Moteur de réponse et plateforme de recherche basés sur l'IA,Motore di risposte e piattaforma di ricerca basati sull'IA
playkot,Mobile game development studio,Entwicklungsstudio für mobile Spiele,Studio de développement de jeux mobiles,Studio di sviluppo di giochi per dispositivi mobili
playnvoice,AI-powered medical transcription for clinical documentation,KI-gestützte medizinische Transkription für klinische Dokumentation,Transcription médicale basée sur l'IA pour la documentation clinique,Trascrizione medica basata sull'IA per la documentazione clinica
playrix,Mobile game developer known for Gardenscapes and Homescapes,Mobilspielentwickler bekannt für Gardenscapes und Homescapes,Développeur de jeux mobiles connu pour Gardenscapes et Homescapes,Sviluppatore di giochi mobili noto per Gardenscapes e Homescapes
proton,"Privacy-focused technology company offering encrypted email, VPN, and cloud storage","Datenschutzorientiertes Technologieunternehmen für verschlüsselte E-Mail, VPN und Cloud-Speicher","Entreprise technologique axée sur la confidentialité offrant e-mail chiffré, VPN et stockage cloud","Azienda tecnologica focalizzata sulla privacy che offre e-mail crittografata, VPN e cloud storage"
pwc,"Professional services network providing audit, assurance, tax, and advisory services","Netzwerk für professionelle Dienstleistungen in Wirtschaftsprüfung, Steuerberatung und Unternehmensberatung","Réseau de services professionnels fournissant audit, assurance, fiscalité et conseil","Rete di servizi professionali che fornisce audit, assurance, fiscalità e consulenza"
revolut,Digital banking and financial services super-app,Digitale Banking- und Finanzdienstleistungs-Super-App,Super-application bancaire numérique et de services financiers,Super-app di banking digitale e servizi finanziari
rivr,Autonomous delivery robots for last-mile logistics,Autonome Lieferroboter für die letzte Meile der Logistik,Robots de livraison autonomes pour la logistique du dernier kilomètre,Robot di consegna autonomi per la logistica dell'ultimo miglio
rolex,Swiss luxury watch manufacturer,Schweizer Luxusuhrenhersteller,Manufacture horlogère suisse de luxe,Produttore svizzero di orologi di lusso
semrush,Online visibility management and digital marketing SaaS platform,SaaS-Plattform für Online-Sichtbarkeitsmanagement und digitales Marketing,Plateforme SaaS de gestion de la visibilité en ligne et de marketing digital,Piattaforma SaaS per la gestione della visibilità online e il marketing digitale
servers-com,Bare metal and cloud hosting infrastructure provider,Anbieter von Bare-Metal- und Cloud-Hosting-Infrastruktur,Fournisseur d'infrastructure d'hébergement bare metal et cloud,Fornitore di infrastruttura di hosting bare metal e cloud
sonarsource,Code quality and security analysis platform,Plattform für Codequalität und Sicherheitsanalyse,Plateforme d'analyse de la qualité et de la sécurité du code,Piattaforma di analisi della qualità e della sicurezza del codice
specitec,Software platform for private banking credit and compliance workflows,Softwareplattform für Kredit- und Compliance-Workflows im Private Banking,Plateforme logicielle pour les workflows de crédit et de conformité en banque privée,Piattaforma software per i flussi di lavoro di credito e compliance nel private banking
stripe,Financial infrastructure platform for internet businesses,Finanzinfrastrukturplattform für Internetunternehmen,Plateforme d'infrastructure financière pour les entreprises en ligne,Piattaforma di infrastruttura finanziaria per le aziende su internet
swisscom,"Swiss telecommunications provider offering mobile, internet, and TV services","Schweizer Telekommunikationsanbieter für Mobilfunk, Internet und TV","Opérateur de télécommunications suisse proposant mobile, internet et services TV","Operatore di telecomunicazioni svizzero che offre servizi mobili, internet e TV"
swissquote-bank,Swiss online bank and trading platform,Schweizer Onlinebank und Handelsplattform,Banque en ligne et plateforme de trading suisse,Banca online e piattaforma di trading svizzera
tethys-robotics,Underwater inspection and monitoring robotics,Unterwasserinspektions- und Überwachungsrobotik,Robotique d'inspection et de surveillance sous-marine,Robotica per l'ispezione e il monitoraggio subacqueo
toloka,AI data labeling and annotation platform,KI-Datenlabeling- und Annotationsplattform,Plateforme d'étiquetage et d'annotation de données pour l'IA,Piattaforma di etichettatura e annotazione dati per l'IA
twitch,Live streaming platform for gaming and entertainment content,Live-Streaming-Plattform für Gaming- und Unterhaltungsinhalte,Plateforme de streaming en direct pour le gaming et le divertissement,Piattaforma di streaming live per contenuti gaming e di intrattenimento
uniqlo,"Japanese casual wear designer, manufacturer, and retailer","Japanischer Designer, Hersteller und Einzelhändler für Freizeitkleidung","Créateur, fabricant et détaillant japonais de vêtements décontractés","Designer, produttore e rivenditore giapponese di abbigliamento casual"
unlimit,Global payment infrastructure and processing platform,Globale Zahlungsinfrastruktur- und Verarbeitungsplattform,Plateforme mondiale d'infrastructure et de traitement des paiements,Piattaforma globale di infrastruttura e elaborazione dei pagamenti
valtech,Digital transformation and experience design consultancy,Beratungsunternehmen für digitale Transformation und Experience Design,Cabinet de conseil en transformation digitale et design d'expérience,Società di consulenza per la trasformazione digitale e il design dell'esperienza
vivid-money,Digital banking app for personal and business finance,Digitale Banking-App für persönliche und geschäftliche Finanzen,Application bancaire numérique pour les finances personnelles et professionnelles,App di banking digitale per la finanza personale e aziendale
warner-music,Global music entertainment company across recorded music and publishing,Globales Musikunterhaltungsunternehmen für Tonträger und Musikverlag,Entreprise mondiale de divertissement musical dans la musique enregistrée et l'édition,Azienda globale di intrattenimento musicale nel settore discografico e nell'editoria
white-circle,AI safety company specializing in LLM vulnerability detection and stress testing,KI-Sicherheitsunternehmen spezialisiert auf LLM-Schwachstellenerkennung und Stresstests,Entreprise de sécurité IA spécialisée dans la détection de vulnérabilités des LLM et les tests de résistance,Azienda di sicurezza IA specializzata nel rilevamento di vulnerabilità dei LLM e stress testing
zalando,European online fashion and lifestyle retail platform,Europäische Online-Plattform für Mode und Lifestyle,Plateforme européenne de vente en ligne de mode et lifestyle,Piattaforma europea di vendita online di moda e lifestyle
